71,"$2,000,000",,"$1,950,000","$1,915,934",,"City College of New York, NY for the Charles B. Rangel Center for Public Service to prepare individuals for careers in public service, which may include establishing an endowment, library and archives for such center",New York,,NY,Labor-HHS-Education,Department of Education,Fund for the Improvement of Postsecondary Education,,Rangel,D,NY,,,,,,,,,1
394,"$450,000",,"$438,000","$430,348",,"In Tune Foundation Group, Washington, DC for educational activities",Washington,,DC,Labor-HHS-Education,Department of Education,Fund for the Improvement of Education,,Hoyer,D,MD,,,,,,,,,1
1419,,"$250,000","$390,000","$383,187",,"Jazz at Lincoln Center, New York, NY for music education programs",New York,,NY,Labor-HHS-Education,Department of Education,Fund for the Improvement of Education,,Nadler,D,NY,,Clinton; Schumer,D; D,NY; NY,,,,,1
1977,,"$500,000",,"$125,000",$0,University of Mississippi Music Archive,University,,MS,Legislative Branch,Library of Congress,Salary and Expenses,,Wicker,R,MS,,Cochran,R,MS,,,,,1
1216,,"$1,000,000",,"$750,000",$0,Abraham Lincoln Bicentennial Commission,Washington,,DC,Legislative Branch,Library of Congress,Salary and Expenses,,Jackson; LaHood,D; R,IL; IL,,Durbin,D,IL,,,,"Disclosure in report puts the value of the earmark at $150,000. But in the text of the legislation it is valued at $750,000",1
807,,,,"$11,600,000",,Chapel Complex Phase I,Fort Leavenworth,,KS,Military Construction,Military Construction Project Listing,Army,,Boyda,D,KS,,,,,,,,,1
179,,,,"$10,400,000",,Chapel,Fort Leonard Wood,,MO,Military Construction,Military Construction Project Listing,Army,,Skelton,D,MO,,,,,,,,,1
333,,,,"$5,900,000",$0,Unit Chapel,Fort Lee,,VA,Military Construction,Military Construction Project Listing,Army,,Forbes,R,VA,4,,,,,,,,1
1358,,,,"$5,800,000",$0,Addition to Fitness Center,Goodfellow AFB,,TX,Military Construction,Military Construction Project Listing,Air Force,,Conaway,R,TX,,,,,,,,,1
79,,,,"$900,000",,Fitness Center,Naval Station Newport,,RI,Military Construction,Military Construction Project Listing,Navy,,Kennedy,D,RI,,,,,,,,,1
370,,,,"$5,200,000",$0,Student Activity Center & Library,Laughlin AFB,,TX,Military Construction,Military Construction Project Listing,Air Force,,Rodriguez,D,TX,,,,,,,,,1
1282,,,,"$4,800,000",,"Air Conditioning, Vista Del Sol",Twentynine Palms,,CA,Military Construction,Family House Construction,Navy FH,,"Lewis, Jerry",R,CA,41,,,,,,,,1
2799,,"$1,500,000",,"$1,500,000",$0,Dining Facility,"Camp Rudder, Eglin Air Force Base",,FL,Military Construction,Military Construction Project Listing,Army,,,,,,"Nelson, Bill",D,FL,,,,,1
,,"$750,000",,"$750,000",$0,Bachelor Quarters Addition,Naval Station Newport,,RI,Military Construction,Military Construction Project Listing,Navy,,,,,,Reed,D,RI,,,,,1
2105,"$66,000,000","$66,000,000","$66,000,000","$65,465,000","$66,000,000",Water Quality Program -- Secondary Treatment of Tijuana Sewage,,,INT,State-Foreign Ops,Department of State,"International Boundary and Water Commission, United States and Mexico; Construction",,,,,,,,,President-Solo & Und.,,,,1
86,,"$4,000,000","$3,000,000","$2,940,000",,Coast Transit Authority Bus and Bus Facilities,,,MS,Transportation and Housing & Urban Development,Transportation,FTA; Buses and Bus Facilities,,,,,,Cochran,R,MS,,,,,1
2384,,"$3,000,000","$3,000,000","$2,940,000",,Highway 9 4-Lane Corridor,,,MS,Transportation and Housing & Urban Development,Transportation,FHWA; Surface Transportation Priorities,,,,,,Cochran,R,MS,,,,,1
968,,"$2,200,000","$1,500,000","$1,470,000",,Statesman Blvd. and Trail,,,MS,Transportation and Housing & Urban Development,Transportation,FHWA; Delta Regional Transportation Development Program,,,,,,Cochran,R,MS,,,,,1
523,,"$200,000","$200,000","$196,000",,"Southern Cultural Heritage Foundation, for the renovation of the Southern Cultural Heritage Center Auditorium",Vicksburg,,MS,Transportation and Housing & Urban Development,HUD,Economic Development Initiatives,,,,,,Cochran,R,MS,,,,,1
454,,"$200,000","$200,000","$196,000",,"Town of Marietta, for the construction of a multi-purpose facility",Marietta,,MS,Transportation and Housing & Urban Development,HUD,Economic Development Initiatives,,,,,,Cochran,R,MS,,,,,1
362,,"$250,000","$200,000","$196,000",,"City of Grenada, for the renovation of the historic Taylor Hall",Grenada,,MS,Transportation and Housing & Urban Development,HUD,Economic Development Initiatives,,,,,,Cochran,R,MS,,,,,1
618,,"$2,000,000","$1,500,000","$1,470,000",,Statewide Bus & Bus Facilities,,,MO,Transportation and Housing & Urban Development,Transportation,FTA; Buses and Bus Facilities,,,,,,Bond,R,MO,,,,,1
668,,"$750,000","$562,500","$551,250",,Heart of America Bicycle/Pedestrian Bridge,,,MO,Transportation and Housing & Urban Development,Transportation,FHWA; Surface Transportation Priorities,,,,,,Bond,R,MO,,,,,1
34,,"$500,000","$375,000","$367,500",,Grant City Downtown Square Street Improvements,,,MO,Transportation and Housing & Urban Development,Transportation,FHWA; Surface Transportation Priorities,,,,,,Bond,R,MO,,,,,1
1354,,"$500,000","$750,000","$735,000",,"City of Kansas City, for redevelopment of the 11th and Grand Neighborhood",Kansas City,,MO,Transportation and Housing & Urban Development,HUD,Economic Development Initiatives,,,,,,Bond,R,MO,,,,,1
8,"$6,000,000",,"$6,000,000","$5,880,000",,MBTA Fitchburg to Boston Rail Corridor Project Development and Construction,,,MA,Transportation and Housing & Urban Development,Transportation,FTA; Small Starts,,Olver,D,MA,1,,,,,,,,1
,"$1,000,000",,"$1,500,000","$1,470,000",,Pittsfield Downtown Streetscape,,,MA,Transportation and Housing & Urban Development,Transportation,FHWA; Surface Transportation Priorities,,Olver,D,MA,1,,,,,,,,1
647,"$800,000",,"$800,000","$784,000",,"FRTA, Franklin Regional Transit Center",,,MA,Transportation and Housing & Urban Development,Transportation,FTA; Buses and Bus Facilities,,Olver,D,MA,1,,,,,,,,1
1022,"$750,000",,"$750,000","$735,000",,MART Bus and Commuter Facilities,,,MA,Transportation and Housing & Urban Development,Transportation,FTA; Buses and Bus Facilities,,Olver,D,MA,1,,,,,,,,1
2837,"$275,000",,"$275,000","$269,500",,"Barrington Stage Company in Pittsfield, for renovation and build out of the Berkshire Music Hall and Octagon House",Pittsfield,,MA,Transportation and Housing & Urban Development,HUD,Economic Development Initiatives,,Olver,D,MA,1,,,,,,,,1
473,"$100,000",,"$200,000","$196,000",,Massachusetts Landscape Connectivity Study,,,MA,Transportation and Housing & Urban Development,Transportation,FHWA; Surface Transportation Priorities,,Olver,D,MA,1,,,,,,,,1
1697,"$500,000",,"$500,000","$490,000",,City of Bellflower for construction and build out of the Los Angeles County Fire Museum,Bellflower,,CA,Transportation and Housing & Urban Development,HUD,Economic Development Initiatives,,Roybal-Allard,D,CA,,,,,,,,,1
1918,,"$200,000","$200,000","$196,000",,"City of Las Vegas, to complete renovation and transformation of the historic Post Office in downtown Las Vegas to a museum on local history",Las Vegas,,NV,Transportation and Housing & Urban Development,HUD,Economic Development Initiatives,,,,,,Reid,D,NV,,,,,1
4,"$150,000",,"$150,000","$147,000",,Western Mining and Railroad Museum for construction and renovation of an addition to the museum to improve accessibility,Helper,,UT,Transportation and Housing & Urban Development,HUD,Economic Development Initiatives,,Matheson,D,UT,,,,,,,,,1
1954,"$100,000",,"$100,000","$98,000",,Audie Murpy/American Cotton Museum for construction of a memorial and building,Greenville,,TX,Transportation and Housing & Urban Development,HUD,Economic Development Initiatives,,"Hall, Ralph",R,TX,,,,,,,,,1
2987,"$50,000",,"$50,000","$49,000",,"Woodbridge Township, NJ, for construction of a Woodbridge Historical Museum",Woodbridge,,NJ,Transportation and Housing & Urban Development,HUD,Economic Development Initiatives,,Ferguson,R,NJ,,,,,,,,,1
1142,"$500,000",,"$1,000,000","$980,000",,Interstate 66,,Pike,KY,Transportation and Housing & Urban Development,Transportation,FHWA; Surface Transportation Priorities,,"Rogers, Harold",R,KY,,,,,,,,,1
1738,"$500,000",,"$1,500,000","$1,470,000",,Interstate 66 Somerset to London,,,KY,Transportation and Housing & Urban Development,Transportation,FHWA; Surface Transportation Priorities,,"Rogers, Harold",R,KY,,,,,,,,,1
1525,"$250,000",,"$700,000","$686,000",,Cambridge-Isanti Bike/Walk Trail,,,MN,Transportation and Housing & Urban Development,Transportation,FHWA; Surface Transportation Priorities,,Oberstar,D,MN,,,,,,,,,1
1821,"$500,000",,"$500,000","$490,000",,Lane expansion of RM 1431,,,TX,Transportation and Housing & Urban Development,Transportation,FHWA; Transportation and Community and System Preservation,,Carter,R,TX,,Cornyn,R,TX,,,,,1
1158,,"$500,000","$335,000","$328,300",,"City of Billings, Big Sky Economic Development Authority for historic preservation of the Cobb Field facility",Billings,,MT,Transportation and Housing & Urban Development,HUD,Economic Development Initiatives,,,,,,Baucus; Tester,D; D,MT; MT,,,,,1
2228,,"$450,000","$301,500","$295,470",,International Peace Garden facility renovation,Dunseith,,ND,Transportation and Housing & Urban Development,HUD,Economic Development Initiatives,,,,,,Conrad; Dorgan,D; D,ND; ND,,,,,1
1832,"$250,000",,"$250,000","$245,000",,Walter Clore Wine and Culinary Center for construction,Prosser,,WA,Transportation and Housing & Urban Development,HUD,Economic Development Initiatives,,"Hastings, Doc",R,WA,,Cantwell; Murray,D; D,WA; WA,,,,,1
320,"$150,000",,"$150,000","$147,000",,"Graveyard of the Atlantic Museum, for completion of construction of the Graveyard of the Atlantic Museum",Hatteras,,NC,Transportation and Housing & Urban Development,HUD,Economic Development Initiatives,,"Jones, Walter",R,NC,,,,,,,,,1
545,"$100,000",,"$100,000","$98,000",,Wakely Lodge Resort for renovation of the Wakely Lodge,,Hamilton,NY,Transportation and Housing & Urban Development,HUD,Economic Development Initiatives,,McHugh,R,NY,,,,,,,,,1
1650,"$100,000",,"$100,000","$98,000",,Town of Boydton for development of the Walking Tour of Boydton,Boydton,,VA,Transportation and Housing & Urban Development,HUD,Economic Development Initiatives,,Goode,R,VA,,,,,,,,,1
1909,"$50,000",,"$50,000","$49,000",,"National Forest Recreation Association, for construction of a National Mule and Packers Museum in Bishop, CA",Woodlake,,CA,Transportation and Housing & Urban Development,HUD,Economic Development Initiatives,,McKeon,R,CA,,,,,,,,,1